{
  "schemaVersion": 1,
  "packId": "drills-core",
  "packVersion": 2,
  "kind": "drill",
  "tier": "free",
  "title": "The alphabet, one letter at a time",
  "summary": "All 24 static letters, each with a plain-language handshape description and a nudge for its most common mix-up.",
  "releasedOn": "2026-09-13",
  "items": [
    {
      "id": "drill-a",
      "type": "drill",
      "letter": "A",
      "prompt": "Show the letter A",
      "description": "Make a fist. Keep your thumb straight up against the side of your pointer finger. Palm faces the camera.",
      "hintId": "hint_thumb_to_side"
    },
    {
      "id": "drill-b",
      "type": "drill",
      "letter": "B",
      "prompt": "Show the letter B",
      "description": "Hold your hand flat, fingers together and pointing up. Fold your thumb across your palm. Palm faces the camera.",
      "hintId": "hint_fingers_together"
    },
    {
      "id": "drill-c",
      "type": "drill",
      "letter": "C",
      "prompt": "Show the letter C",
      "description": "Curve your fingers and thumb as if holding a can, leaving a gap between them. Turn your hand so the C faces the side.",
      "hintId": "hint_generic"
    },
    {
      "id": "drill-d",
      "type": "drill",
      "letter": "D",
      "prompt": "Show the letter D",
      "description": "Point your pointer finger straight up. Curl your other fingers down to touch your thumb tip, making a small circle. Palm faces the camera.",
      "hintId": "hint_index_up_curled"
    },
    {
      "id": "drill-e",
      "type": "drill",
      "letter": "E",
      "prompt": "Show the letter E",
      "description": "Bend all four fingers down so their tips rest on your thumb. Tuck your thumb across your palm under them. Palm faces the camera.",
      "hintId": "hint_generic"
    },
    {
      "id": "drill-f",
      "type": "drill",
      "letter": "F",
      "prompt": "Show the letter F",
      "description": "Touch your pointer fingertip to your thumb tip to make a circle. Keep your other three fingers up and slightly apart. Palm faces the camera.",
      "hintId": "hint_three_straight"
    },
    {
      "id": "drill-g",
      "type": "drill",
      "letter": "G",
      "prompt": "Show the letter G",
      "description": "Point your pointer finger to the side, with your thumb above it and parallel. Curl your other fingers in. Palm faces you.",
      "hintId": "hint_point_forward"
    },
    {
      "id": "drill-h",
      "type": "drill",
      "letter": "H",
      "prompt": "Show the letter H",
      "description": "Point your pointer and middle fingers to the side, together. Curl your other fingers in. Palm faces you.",
      "hintId": "hint_fingers_together"
    },
    {
      "id": "drill-i",
      "type": "drill",
      "letter": "I",
      "prompt": "Show the letter I",
      "description": "Make a fist with your thumb across the front. Raise only your pinky straight up. Palm faces the camera.",
      "hintId": "hint_generic"
    },
    {
      "id": "drill-k",
      "type": "drill",
      "letter": "K",
      "prompt": "Show the letter K",
      "description": "Raise your pointer finger and middle finger in a V. Press your thumb tip against the middle of your middle finger. Palm faces the camera.",
      "hintId": "hint_point_forward"
    },
    {
      "id": "drill-l",
      "type": "drill",
      "letter": "L",
      "prompt": "Show the letter L",
      "description": "Point your pointer finger up and your thumb out to the side to make an L. Curl your other fingers in. Palm faces the camera.",
      "hintId": "hint_generic"
    },
    {
      "id": "drill-m",
      "type": "drill",
      "letter": "M",
      "prompt": "Show the letter M",
      "description": "Make a fist. Tuck your thumb under your pointer, middle and ring fingers so three fingers cover it. Palm faces the camera.",
      "hintId": "hint_thumb_under_three"
    },
    {
      "id": "drill-n",
      "type": "drill",
      "letter": "N",
      "prompt": "Show the letter N",
      "description": "Make a fist. Tuck your thumb under your pointer and middle fingers so two fingers cover it. Palm faces the camera.",
      "hintId": "hint_thumb_under_two"
    },
    {
      "id": "drill-o",
      "type": "drill",
      "letter": "O",
      "prompt": "Show the letter O",
      "description": "Curve all your fingers so their tips touch your thumb tip, making a round O. Turn your hand so the O faces the side.",
      "hintId": "hint_generic"
    },
    {
      "id": "drill-p",
      "type": "drill",
      "letter": "P",
      "prompt": "Show the letter P",
      "description": "Make the K shape, then tip your hand so your fingers point down toward the floor.",
      "hintId": "hint_point_down"
    },
    {
      "id": "drill-q",
      "type": "drill",
      "letter": "Q",
      "prompt": "Show the letter Q",
      "description": "Make the G shape, then tip your hand so your pointer finger and thumb point down toward the floor.",
      "hintId": "hint_point_down"
    },
    {
      "id": "drill-r",
      "type": "drill",
      "letter": "R",
      "prompt": "Show the letter R",
      "description": "Raise your pointer and middle fingers and cross them, like fingers crossed for luck. Curl your other fingers in. Palm faces the camera.",
      "hintId": "hint_cross_fingers"
    },
    {
      "id": "drill-s",
      "type": "drill",
      "letter": "S",
      "prompt": "Show the letter S",
      "description": "Make a fist and wrap your thumb across the front of your fingers. Palm faces the camera.",
      "hintId": "hint_thumb_across_front"
    },
    {
      "id": "drill-t",
      "type": "drill",
      "letter": "T",
      "prompt": "Show the letter T",
      "description": "Make a fist and tuck your thumb between your pointer and middle fingers, tip just showing. Palm faces the camera.",
      "hintId": "hint_thumb_between_index_middle"
    },
    {
      "id": "drill-u",
      "type": "drill",
      "letter": "U",
      "prompt": "Show the letter U",
      "description": "Raise your pointer and middle fingers straight up, pressed together. Hold your other fingers down with your thumb. Palm faces the camera.",
      "hintId": "hint_fingers_together"
    },
    {
      "id": "drill-v",
      "type": "drill",
      "letter": "V",
      "prompt": "Show the letter V",
      "description": "Raise your pointer and middle fingers straight up, spread apart. Hold your other fingers down with your thumb. Palm faces the camera.",
      "hintId": "hint_spread_fingers"
    },
    {
      "id": "drill-w",
      "type": "drill",
      "letter": "W",
      "prompt": "Show the letter W",
      "description": "Raise your pointer, middle and ring fingers, spread apart. Hold your pinky down with your thumb. Palm faces the camera.",
      "hintId": "hint_spread_fingers"
    },
    {
      "id": "drill-x",
      "type": "drill",
      "letter": "X",
      "prompt": "Show the letter X",
      "description": "Make a fist, then raise your pointer finger and bend it into a hook. Turn your hand so your palm faces the side.",
      "hintId": "hint_hook_index"
    },
    {
      "id": "drill-y",
      "type": "drill",
      "letter": "Y",
      "prompt": "Show the letter Y",
      "description": "Stretch your thumb and pinky out. Curl your middle three fingers into your palm. Palm faces the camera.",
      "hintId": "hint_generic"
    }
  ]
}
